Step,Instruction
1,"Cut the honeydew melon into small cubes and place them in a large bowl."
2,"In a small bowl, whisk together lime juice and honey."
3,"Pour the lime juice and honey mixture over the honeydew melon cubes and toss gently to coat."
4,"Add crumbled feta cheese and chopped fresh mint leaves to the bowl."
5,"Toss everything together until well combined."
6,"Refrigerate the salad for at least 30 minutes before serving to allow the flavors to meld."
7,"Serve chilled as a refreshing side dish."
