Step,Instruction
1,"Drain and rinse chickpeas."
2,"Chop onion, garlic, and ginger."
3,"Heat oil in a large pot over medium heat. Add onion and cook until softened."
4,"Add garlic, ginger, cumin, coriander, turmeric, and cayenne pepper. Cook for 30 seconds, or until fragrant."
5,"Stir in chickpeas, garam masala, coconut milk, and tomatoes. Bring to a boil, then reduce heat and simmer for 15 minutes."
6,"Stir in spinach and cook until wilted."
7,"Squeeze lime juice over the curry and garnish with cilantro."
8,"Serve with rice or naan."