Step,Instruction
1,"Preheat the oven to 375°F."
2,"In a bowl, mix diced strawberries with balsamic vinegar, chopped basil leaves, salt, and black pepper."
3,"Brush baguette slices with olive oil and arrange them on a baking sheet."
4,"Bake the baguette slices in the preheated oven for 8-10 minutes until lightly toasted."
5,"Top each toasted baguette slice with a spoonful of the strawberry mixture."
6,"Sprinkle crumbled goat cheese over the strawberry mixture on each slice."
7,"Serve the strawberry balsamic bruschetta immediately as a flavorful side dish or appetizer."
