Step,Instruction
1,Wash the radishes and trim off the tops and roots. Thinly slice the radishes.
2,Peel and thinly slice the cucumber. Thinly slice the red onion.
3,"In a large bowl, combine the sliced radishes, cucumber, red onion, and chopped fresh dill."
4,"In a small bowl, mix together Greek yogurt, salt, and black pepper to make the dressing."
5,Pour the dressing over the salad and toss gently to coat.
6,Refrigerate the salad for at least 30 minutes before serving to allow the flavors to meld.
7,Serve chilled as a refreshing side dish.
