Step,Instruction
1,"Preheat your oven to 375°F."
2,"Peel and mince the garlic cloves. Strip the rosemary and thyme leaves from their stems and chop them finely."
3,"In a small bowl, combine the minced garlic, chopped rosemary, chopped thyme, olive oil, salt, and black pepper to make the herb rub."
4,"Place the pork loin roast on a cutting board and pat it dry with paper towels."
5,"Rub the herb mixture all over the surface of the pork loin roast, ensuring it is evenly coated."
6,"Transfer the seasoned pork loin roast to a roasting pan or baking dish."
7,"Roast the pork loin in the preheated oven for 60-70 minutes, or until the internal temperature reaches 145°F."
8,"Once cooked, remove the pork loin roast from the oven and let it rest for 10-15 minutes before slicing."
9,"Slice the pork loin roast into thick slices and serve hot."
