Step,Instruction
1,"Dice the onion, mince the garlic, and grate the ginger. Chop the tomatoes."
2,"In a large skillet, heat some oil over medium heat."
3,"Add the diced onion to the skillet and cook until softened, about 5 minutes."
4,"Add the minced garlic and grated ginger to the skillet and cook for another minute."
5,"Stir in the chopped tomatoes, curry powder, turmeric, cayenne pepper, and salt."
6,"Cook for 2-3 minutes, until the tomatoes begin to break down."
7,"Add the canned chickpeas (rinsed and drained) and coconut milk to the skillet."
8,"Bring the mixture to a simmer and cook for 10-15 minutes, until the flavors have melded and the sauce has thickened."
9,"Serve hot as a delicious and spicy side dish, optionally garnished with fresh cilantro."
