Step,Instruction
1,Cook the onion in a large skillet with 1 tablespoon of oil until softened. Set aside when done.
2,"Coat chicken in flour, salt, and pepper by placing them in a bag and shaking to coat. Let sit for 5 minutes. Brown chicken on all sides in a skillet with hot oil, then transfer to a roasting pan."
3,Preheat oven to 350°F (175°C).
4,"I'm sorry, it seems like the steps are mixed up from different recipes. Would you like me to help you with a specific recipe or provide information on how to fix this error?"
5,"Bake, uncovered, in the preheated oven for 35 to 45 minutes, or until the chicken is cooked through and tender. If the gravy is too thick, add water gradually to achieve the desired consistency."
