Step,Instruction
1,"In a saucepan, combine chopped star fruit, water, and sugar."
2,"Place the saucepan over medium heat and bring the mixture to a simmer, stirring occasionally."
3,"Simmer the mixture for about 5-7 minutes until the star fruit is soft and the sugar has dissolved."
4,"Remove the saucepan from heat and let the mixture cool to room temperature."
5,"Transfer the cooled mixture to a blender or food processor, add lemon juice, and blend until smooth."
6,"Pour the blended mixture into a shallow dish and freeze for about 4 hours, or until set."
7,"Once frozen, use a fork to scrape the sorbet into fluffy ice crystals."
8,"Serve the star fruit sorbet immediately as a refreshing and fruity side dish or dessert."
