Step,Instruction
1,"Preheat the oven to 375°F."
2,"Cut the pears in half and remove the cores."
3,"Place the pear halves, cut side up, on a baking sheet lined with parchment paper."
4,"In a small bowl, mix together honey, cinnamon, and melted butter."
5,"Brush the honey mixture over the tops of the pear halves."
6,"Roast the pears in the preheated oven for 25-30 minutes, or until tender and caramelized."
7,"Remove the roasted pears from the oven and let them cool slightly."
8,"Serve the roasted pears warm, drizzled with any remaining honey mixture, as a deliciously sweet side dish or dessert."
