Step,Instruction
1,Peel the carrots and slice them into thin rounds or strips.
2,Heat vegetable oil in a large skillet or wok over medium-high heat.
3,"Add minced ginger to the skillet and stir-fry for about 30 seconds, until fragrant."
4,"Add the sliced carrots to the skillet and continue to stir-fry for 3-4 minutes,  until they start to soften."
5,"In a small bowl,  mix soy sauce and honey until well combined."
6,Pour the soy sauce mixture over the carrots in the skillet and toss to coat evenly.
7,"Continue to stir-fry for another 2-3 minutes,  or until the carrots are tender but still slightly crisp."
8,Remove from heat and garnish with sliced green onions.
9,Serve hot as a tasty side dish.
