Step,Instruction
1,"Rinse quinoa under cold water."
2,"Combine quinoa and water in a saucepan. Bring to a boil, then reduce heat and simmer for 15 minutes, or until water is absorbed."
3,"Fluff quinoa with a fork and let cool completely."
4,"Chop cucumber, cherry tomatoes, and red onion."
5,"Combine quinoa, cucumber, tomatoes, red onion, and dill in a large bowl."
6,"In a small bowl, whisk together olive oil, lemon juice, Dijon mustard, honey, salt, and pepper."
7,"Pour dressing over quinoa mixture and toss to coat."
8,"Serve chilled."