Step,Instruction
1,"Preheat oven to 375°F. Line baking sheets with parchment paper."
2,"Combine dry ingredients: In a medium bowl, whisk together flour, baking soda, and salt."
3,"Cream wet ingredients: In a large bowl, cream together butter, granulated sugar, and brown sugar until light and fluffy."
4,"Beat in eggs: Beat in eggs one at a time, then stir in vanilla."
5,"Combine wet and dry: Gradually add dry ingredients to wet ingredients, mixing until just combined. Stir in chocolate chips."
6,"Scoop and bake: Drop by rounded tablespoons onto prepared baking sheets. Bake for 9-11 minutes, or until golden brown."
7,"Cool: Let cool on baking sheets for a few minutes before transferring to wire racks to cool completely."