Step,Instruction
1,"Preheat the grill to medium-high heat (around 375-400°F)."
2,"Peel back the husks from the corn, but leave them attached. Remove the silk."
3,"Spread butter over each ear of corn and season with salt and black pepper."
4,"Pull the husks back over the corn and tie them with kitchen twine to secure."
5,"Grill the corn on the preheated grill for about 15-20 minutes, turning occasionally, until tender and slightly charred."
6,"Remove from the grill, unwrap, and serve hot as a delicious side dish."
