Step,Instruction
1,Heat the oven to 350 degrees F (175 degrees C) and lightly grease a 10 ½ x 15 ½-inch jelly roll pan with butter.
2,"Prepare the brownies by combining both brownie mix packets in a large bowl. Mix in the Irish cream liqueur, oil, and eggs with an electric mixer until smooth. Spread the batter into the greased pan."
3,"Bake the brownies in the preheated oven until they are set and a toothpick inserted into the center comes out clean, approximately 20 minutes."
4,Let the brownies cool completely for about 20 to 30 minutes after removing them from the oven.
5,"Beat softened butter in a large mixing bowl until smooth. Incorporate Irish cream liqueur and continue beating until creamy. Gradually add confectioners' sugar, one cup at a time, until the frosting reaches the desired consistency."
6,Spread that delicious frosting over the cooled brownies and then slice them into 30 squares.
