Step,Instruction
1,"In a saucepan, combine pitted sour cherries, chicken or beef broth, red wine, and sugar."
2,"Place the saucepan over medium heat and bring the mixture to a simmer."
3,"In a small bowl, mix cornstarch with water until smooth to create a slurry."
4,"Slowly pour the cornstarch slurry into the simmering cherry mixture, stirring constantly."
5,"Continue to cook the sauce, stirring frequently, until it thickens to your desired consistency."
6,"Season the sour cherry sauce with salt and pepper to taste."
7,"Remove the saucepan from heat and serve the sauce alongside grilled or roasted meats."
