Step,Instruction
1,Wash the radishes and trim off the tops and roots. Thinly slice the radishes.
2,"In a small saucepan, combine white vinegar, water, sugar, salt, and black peppercorns. Bring to a boil, stirring until the sugar and salt are dissolved."
3,Place the sliced radishes in a clean glass jar.
4,"Pour the hot vinegar mixture over the radishes, making sure they are completely submerged."
5,"Let the pickled radishes cool to room temperature, then cover the jar and refrigerate for at least 2 hours before serving."
6,Serve the pickled radishes as a tangy and crunchy side dish.
