step,instruction
1,"Preheat oven to 425 degrees Fahrenheit (220 degrees Celsius)."
2,"Peel the butternut squash and cut it in half lengthwise. Scoop out the seeds and discard."
3,"Cut the squash into 1-inch cubes."
4,"Place the squash cubes in a large bowl and toss with olive oil."
5,"Season generously with salt and black pepper."
6,"Spread the squash cubes in a single layer on a baking sheet."
7,"Bake for 20-25 minutes, or until tender and golden brown on the edges."
8,"Serve immediately and enjoy!"