Step,Instruction
1,"Drain and rinse black beans."
2,"Chop onion and garlic."
3,"Heat olive oil in a skillet over medium heat. Add onion and garlic, cook until softened."
4,"Stir in black beans, cumin, chili powder, paprika, salt, and pepper. Cook for 5 minutes."
5,"Warm taco shells according to package directions."
6,"For guacamole: Cut avocado in half, remove pit, and scoop out flesh into a bowl."
7,"Add juice of one lime, diced tomato, chopped onion, cilantro, salt, and pepper to the avocado."
8,"Mash avocado with a fork until desired consistency."
9,"Fill taco shells with black bean mixture and top with guacamole."