Step,Instruction
1,"In a large bowl, combine flour, baking powder, and salt. Add milk, eggs, and oil; mix until just combined. Gently fold in the corn, green onions, and cheese until evenly distributed."
2,"Stir in onion, garlic, and chili powder; continue to cook until onion is soft, about 3 minutes."
3," Stir in the tomatoes, taco seasoning, and water, then bring to a gentle simmer; cook for about 5 minutes."
4,"In a medium bowl, combine cooked rice, beef mixture, and 1 cup cheese; stir until well mixed."
5,"Sprinkle remaining cheese over the top. Bake in the preheated oven until cheese is melted and bubbly, about 20 minutes."
6,"Remove from the oven and let cool for a few minutes before serving."
7,"Feel free to enjoy it with your preferred toppings, like diced tomatoes or avocado slices, if you wish."
