Step,Instruction
1,Preheat the oven to 375°F.
2,Slice the French bread into desired thickness.
3,Mince the garlic cloves and chop the fresh parsley.
4,"In a small bowl, mix together minced garlic, softened butter, chopped parsley, and salt."
5,Spread the garlic butter mixture evenly on each slice of bread.
6,Wrap the bread in aluminum foil and place on a baking sheet.
7,"Bake in the preheated oven for 10-15 minutes, or until the bread is warm and the butter is melted."
8,Unwrap the bread and broil for an additional 2-3 minutes until the top is golden brown and crispy.
9,Serve hot as a delicious and fragrant side dish.
