Step,Instruction
1,"Bloom gelatin: In a small bowl, combine gelatin and cold water. Let sit for 5 minutes, or until softened."
2,"Heat cream and milk: In a medium saucepan, combine heavy cream, milk, sugar, and vanilla bean seeds (or vanilla extract). Heat over medium heat until simmering, but do not boil."
3,"Dissolve gelatin: Remove saucepan from heat. Squeeze excess water from gelatin and add it to the warm cream mixture. Stir until gelatin dissolves completely."
4,"Strain and distribute: Strain the mixture through a fine-mesh sieve into individual serving dishes or a large bowl."
5,"Refrigerate: Cover the panna cotta and refrigerate for at least 4 hours, or until set."
6,"Serve: Serve chilled with desired toppings, such as fresh berries, chocolate sauce, or whipped cream."