Step,Instruction
1,"In a separate bowl, mix together taco seasoning, corn, and tomato sauce. Stir into the beef mixture and cook until hot, about 3 minutes."
2,"Lay out the aluminum foil pieces and spoon equal portions of the beef mixture onto the center of each piece."
3,"Wrap each burrito tightly in aluminum foil and place on a baking sheet."
4,"Preheat the oven to 375 degrees F (190 degrees C)."
5,"Set up the milk cartons in a safe cooking area outdoors. Ignite each carton at one of the vents and cook until they burn down, approximately 2 minutes. Carefully unwrap the burritos using heatproof gloves."
6,"Substitute corn tortillas for flour tortillas if preferred. Customize the fillings to suit your taste."
7,"Feel free to add other ingredients such as beans, corn, or grilled vegetables to enhance the filling."
8,"Use care when unwrapping the burritos, as they will be extremely hot. Make sure to wear heatproof gloves."
