step,instruction
1,"Heat olive oil in a large skillet over medium heat until shimmering."
2,"Add onion and cook, stirring occasionally, until softened (about 4 minutes)."
3,"Add garlic and cook for 1 minute more. Do not brown."
4,"Add ground beef, chili powder, cumin, oregano, garlic powder, salt, and black pepper. Cook, stirring constantly and breaking meat up with a wooden spoon, until the beef is no longer pink (about 5 minutes)."
5,"Stir in tomato paste and water. Bring to a simmer and cook for a few minutes until the sauce thickens slightly."
6,"Warm corn tortillas according to package instructions (microwave, stovetop, etc.)."
7,"Assemble tacos by placing a scoop of beef mixture in each tortilla. Top with shredded cheese and your desired taco toppings (sour cream, salsa, lettuce, etc.)."
8,"Serve immediately and enjoy!"