Step,Instruction
1,"Preheat oven to 375°F. Slice chicken breasts horizontally to make thinner cutlets. Season with salt and black pepper."
2,"Heat olive oil in a skillet over medium-high heat. Cook chicken cutlets for 3-4 minutes per side or until golden brown and cooked through. Remove from skillet and let cool."
3,"Cut the Romaine lettuce into bite-sized pieces and place them in a large salad bowl."
4,"In a small bowl, combine Caesar dressing, freshly squeezed lemon juice, minced garlic, salt, and black pepper. Whisk until well combined."
5,"Add croutons and grated Parmesan cheese to the bowl with Romaine lettuce."
6,"Slice the cooked chicken cutlets into strips and add them to the salad bowl."
7,"Pour the prepared Caesar dressing over the salad ingredients."
8,"Toss the salad gently until all ingredients are evenly coated with the dressing."
9,"Serve immediately as an appetizer or as a main course."
