Step,Instruction
1,"Preheat oven to 400 degrees Fahrenheit."
2,"Combine coconut flakes and panko breadcrumbs in a shallow dish."
3,"Beat egg in a separate shallow dish."
4,"Spread flour on a third shallow dish."
5,"Season tilapia fillets with salt and pepper."
6,"Dredge tilapia fillets in flour, then egg, and finally coconut mixture."
7,"Heat olive oil in a large skillet over medium-high heat."
8,"Cook tilapia fillets for 3-4 minutes per side, or until golden brown and cooked through."
9,"Alternatively, place tilapia fillets on a baking sheet lined with parchment paper and bake for 12-15 minutes, or until cooked through."