Step,Instruction
1,"Preheat the grill to medium heat (around 350°F)."
2,"In a bowl, toss cherry tomatoes with olive oil, balsamic vinegar, minced garlic, chopped fresh thyme, salt, and black pepper."
3,"Thread the cherry tomatoes onto skewers, leaving a little space between each tomato."
4,"Grill the cherry tomato skewers over medium heat for about 5-7 minutes, turning occasionally, until tomatoes are slightly charred and softened."
5,"Remove the skewers from the grill and transfer the grilled balsamic cherry tomatoes to a serving plate."
6,"Serve the grilled balsamic cherry tomatoes as a flavorful and juicy side dish."
