step,instruction
1,"Bring a large pot of salted water to a boil over high heat. Add the rigatoni and cook according to package instructions for al dente (typically 8-12 minutes)."
2,"While the pasta cooks, heat the olive oil in a large skillet over medium heat. Add the diced onion and cook until softened and translucent, about 5 minutes."
3,"Stir in the minced garlic and cook for an additional minute, until fragrant."
4,"Pour in the crushed tomatoes and bring to a simmer. Season with salt and black pepper to taste."
5,"Let the sauce simmer for 15-20 minutes, allowing it to thicken slightly. Taste and adjust seasonings as needed."
6,"Reserve about 1/2 cup of the pasta water before draining the rigatoni."
7,"Drain the cooked rigatoni and add it directly to the simmering sauce in the skillet. Toss to coat the pasta evenly."
8,"Add a splash or two of reserved pasta water to create a desired consistency for the sauce (optional)."
9,"Serve immediately with fresh basil leaves and shredded parmesan cheese (optional)."