Step,Instruction
1,Clean the mushrooms with a damp cloth and trim the stems.
2,"Slice the mushrooms into halves or quarters, depending on their size."
3,"In a large skillet, melt the butter over medium heat."
4,Add minced garlic to the skillet and sauté for 1-2 minutes until fragrant.
5,"Add the sliced mushrooms to the skillet and cook for 8-10 minutes, stirring occasionally, until they are tender and browned."
6,Season with salt and black pepper to taste.
7,Remove from heat and garnish with chopped fresh parsley before serving.
8,Enjoy hot as a delicious side dish.
